{"schema_version":"1","invocation_id":"123e4567-e89b-42d3-a456-426614174000","task":"classify_error_handling","task_version":"2026-09-04.1","provider":"fake","model":"fake-model","provider_version":"fake-provider 1.0","prompt_sha256":"abababababababababababababababababababababababababababababababab","escalation_state":"first_valid","first_tier_valid":null,"first_tier_sentinel":null,"final_sentinel":false,"cache_hit":false,"usage":{"input_tokens":12,"output_tokens":7,"cache_creation_input_tokens":0,"cache_read_input_tokens":0},"cost_usd":0.001,"response":{"class":"correct","confidence":0.8,"rationale":"fixture","evidence_lines":[1]},"log_path":"logs/fake.jsonl"}
